{
  "$schema": "../../../schemas/color.recipe.schema.json",
  "path": ["primitive"],
  "steps": [25, 50, 100, 200, 300, 400, 500, 600, 700, 800, 900],
  "interactiveSteps": {
    "distance": 40,
    "states": ["hover", "active"],
    "lighterFrom": [300, 400, 500, 800, 1000],
    "darkerFrom": [0, 100, 500, 600, 700]
  },
  "colors": [
    {
      "name": "cerulianBlue",
      "hue": 231.49,
      "saturation": { "min": 0.1, "max": 0.68 }
    },
    {
      "name": "coralRed",
      "hue": 20,
      "saturation": { "min": 0.1, "max": 0.92 }
    },
    {
      "name": "creamYellow",
      "hue": 82.36,
      "saturation": { "min": 0.5, "max": 1 }
    },
    {
      "name": "calamineBlue",
      "hue": 202.43,
      "saturation": { "min": 0.1, "max": 0.72 }
    },
    {
      "name": "turquoiseGreen",
      "hue": 158.68,
      "saturation": { "min": 0.1, "max": 0.76 }
    },
    {
      "name": "driftwood",
      "hue": 67.57,
      "saturation": { "min": 0.06, "max": 0.08 }
    }
  ]
}
